"","id","title","publication_date","viewCount","likeCount","dislikeCount","favoriteCount","commentCount","url"
"1","1CJpCc63Y1Q","تجربة جميع أنواع قهوة نسكافيه","2020-01-01T13:20:59.000Z","32018","2035","104","0","376","https://www.youtube.com/watch?v=1CJpCc63Y1Q"
"2","1QYDAB8cpqU","ايش أفضل زيت زيتون في السعودية؟","2020-01-04T11:14:10.000Z","210092","6275","1060","0","2194","https://www.youtube.com/watch?v=1QYDAB8cpqU"
"3","2kZz5F8q704","هل الشامبو الي يبيعونه في البقالات أصلي؟","2019-12-19T19:15:25.000Z","44534","2630","194","0","438","https://www.youtube.com/watch?v=2kZz5F8q704"
"4","cDPOCwajJ6s","ايش أفضل شابورة في السعودية؟","2020-01-01T16:42:26.000Z","38145","2228","113","0","403","https://www.youtube.com/watch?v=cDPOCwajJ6s"
"5","CX73wHvYsmw","أطعمة و معلبات يحبها الفلبيني","2019-12-26T10:14:37.000Z","32328","1731","102","0","321","https://www.youtube.com/watch?v=CX73wHvYsmw"
"6","Evhu7Ub2ig4","البيتزا الإيطالية الحقيقية","2019-02-05T15:51:42.000Z","37179","808","31","0","134","https://www.youtube.com/watch?v=Evhu7Ub2ig4"
"7","F9zILhJfw4A","أجبان غريبة نشوفها دائماً في السوبرماركت لكن ما نشتريها","2019-12-25T15:51:03.000Z","60986","3071","198","0","588","https://www.youtube.com/watch?v=F9zILhJfw4A"
"8","Fs_WtDTcPLc","أطعمة و معلبات نشوفها دائماً في السوبرماركت ولكن ما نشتريها #4","2020-01-05T18:53:15.000Z","55228","2972","175","0","482","https://www.youtube.com/watch?v=Fs_WtDTcPLc"
"9","GpsmJTfIDWg","أطعمة و معلبات دائماً نشوفها في السوبرماركت لكن ما نشتريها #1","2019-12-21T17:00:00.000Z","77629","3788","461","0","778","https://www.youtube.com/watch?v=GpsmJTfIDWg"
"10","JFQriM4P2es","أطعمة ومعلبات نشوفها دائماً في السوبرماركت لكن ما نشتريها #2","2019-12-23T19:51:35.000Z","58103","3152","349","0","666","https://www.youtube.com/watch?v=JFQriM4P2es"
"11","lSUPtdvVXC8","ايش أفضل مكرونة ممكن تشتريها في السوبرماركت السعودي؟","2019-12-30T18:52:09.000Z","35176","1772","108","0","315","https://www.youtube.com/watch?v=lSUPtdvVXC8"
"12","NafTRea8QI8","ايش أفضل جبنة موزاريلا في السعودية؟","2020-01-07T20:48:28.000Z","35602","3118","184","0","795","https://www.youtube.com/watch?v=NafTRea8QI8"
"13","neAamcF7baQ","ايش ألذ قشطة في السعودية؟ تجربة جميع أنواع القشطة","2020-01-03T11:40:07.000Z","98848","4153","402","0","1221","https://www.youtube.com/watch?v=neAamcF7baQ"
"14","QYQjfpPoge4","هل البيتزا الإيطالية في السعودية، هي فعلاً بيتزا إيطالية؟ تجربة بيتزا مطعم روسو بمدينة جدة","2019-12-13T17:05:16.000Z","50023","2750","306","0","606","https://www.youtube.com/watch?v=QYQjfpPoge4"
"15","raKS_tLn3cU","أطعمة و معلبات دائماً نشوفها في السوبرماركت لكن ما نشتريها #3","2019-12-29T18:00:56.000Z","40045","1901","113","0","367","https://www.youtube.com/watch?v=raKS_tLn3cU"
"16","RgcDoN_ABkg","هل الإندومي هو أفضل شعيرية في السعودية؟","2020-01-02T21:03:38.000Z","58610","3291","226","0","467","https://www.youtube.com/watch?v=RgcDoN_ABkg"
"17","rzprtzCczkE","جميع أنواع صلصات التباسكو الحارة","2019-12-24T20:12:04.000Z","29528","1928","91","0","353","https://www.youtube.com/watch?v=rzprtzCczkE"
"18","WnBoxSs4mIQ","هل شاي ليبتون هو أفضل شاي في السعودية؟","2020-01-06T19:52:36.000Z","61815","3604","398","0","1344","https://www.youtube.com/watch?v=WnBoxSs4mIQ"
"19","xKTV_Jjyt1Q","هل أطعمة الأطفال هي فقط للأطفال؟","2019-12-28T10:58:03.000Z","29796","2101","96","0","486","https://www.youtube.com/watch?v=xKTV_Jjyt1Q"
"20","YqY_wEebQww","كيف تسوي الباستا الأسطورية بصلصة البيستو؟","2019-12-22T19:56:45.000Z","23601","2025","77","0","267","https://www.youtube.com/watch?v=YqY_wEebQww"
"21","zOETBQDiPUg","ايش ألذ زبدة فول سوداني في السعودية؟","2019-12-31T17:43:36.000Z","66903","3361","283","0","513","https://www.youtube.com/watch?v=zOETBQDiPUg"
